{
  "$schema": "https://json-schema.org/draft/2020-12/schema",
  "$id": "https://otsec.local/contracts/baseline/0.1/baseline.json",
  "title": "otsec.baseline/0.1 baseline record",
  "description": "C10 event-behaviour baseline of one asset (R4.8). Rules across fields (counts sum, hours sum to full, types ordered by key, collected_s is the period less its gaps, previous set exactly when version > 1, tolerance from the percentage) are enforced by Baseline.Validate in Go; this schema states structure only. Not strict: readers ignore unknown fields. The baseline hash is SHA-256 over the stored bytes exactly, never over a re-encoding.",
  "type": "object",
  "required": [
    "schema",
    "node_id",
    "asset_id",
    "version",
    "learner",
    "params",
    "period",
    "counts",
    "types",
    "recorded_utc"
  ],
  "properties": {
    "schema": {
      "type": "string",
      "pattern": "^otsec\\.baseline/0\\.(0|[1-9][0-9]{0,3})$"
    },
    "node_id": {
      "type": "string",
      "pattern": "^[a-z0-9](?:[a-z0-9-]{0,61}[a-z0-9])?$"
    },
    "asset_id": {
      "$ref": "#/$defs/asset_id"
    },
    "version": {
      "type": "integer",
      "minimum": 1
    },
    "previous": {
      "$ref": "#/$defs/sha256_ref"
    },
    "learner": {
      "type": "object",
      "required": [
        "name",
        "version"
      ],
      "properties": {
        "name": {
          "type": "string",
          "minLength": 1
        },
        "version": {
          "type": "string",
          "minLength": 1
        }
      }
    },
    "params": {
      "type": "object",
      "required": [
        "min_duration_s",
        "min_events",
        "repeats_n",
        "repeats_window_s",
        "rate_bucket_s",
        "rate_factor_pct",
        "rate_min",
        "periodic_min_occurrences",
        "periodic_tolerance_pct",
        "time_clock",
        "max_types",
        "alarm_hold_s",
        "max_alarms_per_hold"
      ],
      "properties": {
        "min_duration_s": {
          "type": "integer",
          "minimum": 1
        },
        "min_events": {
          "type": "integer",
          "minimum": 1
        },
        "repeats_n": {
          "type": "integer",
          "minimum": 1
        },
        "repeats_window_s": {
          "type": "integer",
          "minimum": 1
        },
        "rate_bucket_s": {
          "type": "integer",
          "minimum": 1
        },
        "rate_factor_pct": {
          "type": "integer",
          "minimum": 100
        },
        "rate_min": {
          "type": "integer",
          "minimum": 1
        },
        "periodic_min_occurrences": {
          "type": "integer",
          "minimum": 3
        },
        "periodic_tolerance_pct": {
          "type": "integer",
          "minimum": 0,
          "maximum": 100
        },
        "time_clock": {
          "$ref": "#/$defs/clock"
        },
        "max_types": {
          "type": "integer",
          "minimum": 1,
          "maximum": 65536
        },
        "alarm_hold_s": {
          "type": "integer",
          "minimum": 1
        },
        "max_alarms_per_hold": {
          "type": "integer",
          "minimum": 1,
          "maximum": 16
        }
      }
    },
    "period": {
      "type": "object",
      "required": [
        "start_utc",
        "end_utc",
        "collected_s"
      ],
      "properties": {
        "start_utc": {
          "$ref": "#/$defs/utc"
        },
        "end_utc": {
          "$ref": "#/$defs/utc"
        },
        "collected_s": {
          "type": "integer",
          "minimum": 0
        },
        "gaps": {
          "type": "array",
          "items": {
            "type": "object",
            "required": [
              "from_utc",
              "to_utc",
              "reason"
            ],
            "properties": {
              "from_utc": {
                "$ref": "#/$defs/utc"
              },
              "to_utc": {
                "$ref": "#/$defs/utc"
              },
              "reason": {
                "type": "string",
                "pattern": "^[a-z][a-z0-9._-]{0,63}$"
              }
            }
          }
        }
      }
    },
    "counts": {
      "type": "object",
      "required": [
        "events",
        "full",
        "type_only",
        "unkeyed",
        "not_counted",
        "types_overflow"
      ],
      "properties": {
        "events": {
          "type": "integer",
          "minimum": 0
        },
        "full": {
          "type": "integer",
          "minimum": 0
        },
        "type_only": {
          "type": "integer",
          "minimum": 0
        },
        "unkeyed": {
          "type": "integer",
          "minimum": 0
        },
        "not_counted": {
          "type": "integer",
          "minimum": 0
        },
        "types_overflow": {
          "type": "integer",
          "minimum": 0
        }
      }
    },
    "types": {
      "type": "array",
      "items": {
        "$ref": "#/$defs/type"
      }
    },
    "recorded_utc": {
      "$ref": "#/$defs/utc"
    }
  },
  "$defs": {
    "asset_id": {
      "type": "string",
      "pattern": "^[0-9a-f]{8}-[0-9a-f]{4}-[1-8][0-9a-f]{3}-[89ab][0-9a-f]{3}-[0-9a-f]{12}$"
    },
    "sha256_ref": {
      "type": "string",
      "pattern": "^sha256:[0-9a-f]{64}$"
    },
    "utc": {
      "type": "string",
      "pattern": "^\\d{4}-\\d{2}-\\d{2}T\\d{2}:\\d{2}:\\d{2}(?:\\.\\d{1,9})?Z$"
    },
    "clock": {
      "enum": [
        "received",
        "device"
      ]
    },
    "key": {
      "type": "object",
      "required": [
        "source"
      ],
      "description": "SER: element and state. Syslog: facility and severity (decimal, or both pri-absent), and exactly one of msgid and template.",
      "properties": {
        "source": {
          "enum": [
            "ser",
            "syslog"
          ]
        },
        "element": {
          "type": "string",
          "minLength": 1
        },
        "state": {
          "type": "string",
          "minLength": 1
        },
        "facility": {
          "type": "string",
          "pattern": "^(pri-absent|[0-9]|1[0-9]|2[0-3])$"
        },
        "severity": {
          "type": "string",
          "pattern": "^(pri-absent|[0-7])$"
        },
        "msgid": {
          "type": "string",
          "pattern": "^[!-~]{1,32}$"
        },
        "template": {
          "$ref": "#/$defs/sha256_ref"
        }
      }
    },
    "type": {
      "type": "object",
      "required": [
        "key",
        "text",
        "count",
        "full",
        "hours_utc",
        "max_per_window",
        "max_per_bucket",
        "first_utc",
        "last_utc"
      ],
      "properties": {
        "key": {
          "$ref": "#/$defs/key"
        },
        "text": {
          "type": "string",
          "minLength": 1,
          "maxLength": 128
        },
        "count": {
          "type": "integer",
          "minimum": 1
        },
        "full": {
          "type": "integer",
          "minimum": 0
        },
        "hours_utc": {
          "type": "array",
          "items": {
            "type": "integer",
            "minimum": 0
          },
          "minItems": 24,
          "maxItems": 24
        },
        "max_per_window": {
          "type": "integer",
          "minimum": 1
        },
        "max_per_bucket": {
          "type": "integer",
          "minimum": 0
        },
        "periodic": {
          "type": "object",
          "required": [
            "interval_s",
            "tolerance_s"
          ],
          "properties": {
            "interval_s": {
              "type": "integer",
              "minimum": 1
            },
            "tolerance_s": {
              "type": "integer",
              "minimum": 0
            }
          }
        },
        "first_utc": {
          "$ref": "#/$defs/utc"
        },
        "last_utc": {
          "$ref": "#/$defs/utc"
        }
      }
    }
  }
}
