{
  "schema": "otsec.baseline/0.1",
  "node_id": "site-a",
  "asset_id": "2f1c5e0a-8b7d-4c3e-9a1f-0d2e3c4b5a69",
  "version": 1,
  "learner": {
    "name": "otsec-detection",
    "version": "0.1"
  },
  "params": {
    "min_duration_s": 1209600,
    "min_events": 200,
    "repeats_n": 5,
    "repeats_window_s": 600,
    "rate_bucket_s": 3600,
    "rate_factor_pct": 200,
    "rate_min": 2,
    "periodic_min_occurrences": 6,
    "periodic_tolerance_pct": 10,
    "time_clock": "received",
    "max_types": 4096,
    "alarm_hold_s": 3600,
    "max_alarms_per_hold": 16
  },
  "period": {
    "start_utc": "2026-11-01T00:00:00Z",
    "end_utc": "2026-11-15T02:00:00Z",
    "collected_s": 1209600,
    "gaps": [
      {
        "from_utc": "2026-11-03T10:00:00Z",
        "to_utc": "2026-11-03T12:00:00Z",
        "reason": "failed.timeout"
      }
    ]
  },
  "counts": {
    "events": 260,
    "full": 250,
    "type_only": 5,
    "unkeyed": 3,
    "not_counted": 2,
    "types_overflow": 0
  },
  "types": [
    {
      "key": {
        "source": "ser",
        "element": "51P1P",
        "state": "Asserted"
      },
      "text": "51P1P Asserted",
      "count": 10,
      "full": 5,
      "hours_utc": [
        0,
        0,
        0,
        0,
        0,
        0,
        0,
        0,
        0,
        0,
        0,
        0,
        0,
        0,
        5,
        0,
        0,
        0,
        0,
        0,
        0,
        0,
        0,
        0
      ],
      "max_per_window": 2,
      "max_per_bucket": 2,
      "first_utc": "2026-11-01T14:00:00Z",
      "last_utc": "2026-11-14T14:30:00Z"
    },
    {
      "key": {
        "source": "ser",
        "element": "IN101",
        "state": "Deasserted"
      },
      "text": "IN101 Deasserted",
      "count": 5,
      "full": 5,
      "hours_utc": [
        0,
        0,
        0,
        5,
        0,
        0,
        0,
        0,
        0,
        0,
        0,
        0,
        0,
        0,
        0,
        0,
        0,
        0,
        0,
        0,
        0,
        0,
        0,
        0
      ],
      "max_per_window": 1,
      "max_per_bucket": 1,
      "first_utc": "2026-11-02T03:00:00Z",
      "last_utc": "2026-11-12T03:00:00Z"
    },
    {
      "key": {
        "source": "syslog",
        "facility": "4",
        "severity": "6",
        "template": "sha256:1111111111111111111111111111111111111111111111111111111111111111"
      },
      "text": "heartbeat #",
      "count": 240,
      "full": 240,
      "hours_utc": [
        10,
        10,
        10,
        10,
        10,
        10,
        10,
        10,
        10,
        10,
        10,
        10,
        10,
        10,
        10,
        10,
        10,
        10,
        10,
        10,
        10,
        10,
        10,
        10
      ],
      "max_per_window": 1,
      "max_per_bucket": 1,
      "periodic": {
        "interval_s": 5040,
        "tolerance_s": 504
      },
      "first_utc": "2026-11-01T00:00:00Z",
      "last_utc": "2026-11-15T01:00:00Z"
    }
  ],
  "recorded_utc": "2026-11-15T02:00:01Z"
}
